Title,Price,Rating,Number of Reviews,Description,URL
TP-Link Tapo C320WS Wired Weatherproof Outdoor 2K 4MP QHD Security Camera - White,,4.62,4,"Semi-wireless IP camera can be integrated into your Wi-Fi network or through Ethernet to keep an eye on your surroundings 4MP Super HD full colour camera with 2560 x 1440 video resolution lends super-clear videos to see everything easily Coloured and Long Distance Night Vision gives a clear picture in vivid colours of the events going on up to 98ft (30m) distance during dark and low-light situations Starlight Night Sensor captures stunning visuals and images even in low light conditions Motion sensors send immediate notifications when any suspicious movement is detected Built-in microphone and speaker ensure two-way audio options for easier and clear communication Remote monitoring allows you to manage settings, control camera, and watch footage using compatible app MicroSD card (not included) storage up to 512GB space supports local storage of the recordings Built-in siren and light alarms scare away unwanted visitors for your safety IP66 weatherproof rating makes the camera withstand bad climatic conditions Google Assistant and Amazon Alexa compatibility allow you to control the device with simple and smart voice commands Compatible with iOS 10+ and Android 5+ devices for added convenience",https://www.bestbuy.ca/en-ca/product/tp-link-tapo-c320ws-wired-weatherproof-outdoor-2k-4mp-qhd-security-camera-white/16540395
Arlo Essential Wired Indoor HD Security Camera (2nd Generation) - White - Only at Best Buy,,4.33,1080,"Crisp and clear details anytime Full HD 1080p video resolution lets you enjoy clear and crisp pictures or images every time Night vision lets you see what's happening at night or in low light conditions Comprehensive and efficient monitoring Motion detection feature sends notification to your phone upon detecting movement inside your home Two-way audio with noise-cancelling technology lets you have clear conversations with visitors, kids, or even pets Remote monitoring capability allows you to monitor your home from anywhere, through your compatible mobile device Includes motion, sound, and light sensors for highly efficient performance Integrated siren can be activated manually or automatically through app to effectively deter burglars or unauthorized persons More convenience Pet mode greatly helps homeowners having pets Designed for indoor use Easy to setup using Arlo Secure App provides simple step-by-step instructions IP camera works with Wi-Fi connectivity and does not require hub",https://www.bestbuy.ca/en-ca/product/arlo-essential-wired-indoor-hd-security-camera-2nd-generation-white-only-at-best-buy/17278916
"Elder AI 4K Security Camera System 8Ch NVR 4TB PoE 8-Camera Outdoor, Person & Vehicle Detection & NDAA, Red & Blue Deterrence, Spotlight Home Surveillance 8MP Wired DIY, RB Series",,4.79,4,"【4K Ultra HD - 8MP Resolution】With Elder’s true 4K surveillance, clarity isn’t just better—it’s breathtaking. Packing over 8 million pixels, it delivers ultra-sharp video, rich color, and unmatched detail that brings faces, license plates, and movements into sharp focus, even at night. Upgrade your view. See security in a whole new light. 【AI Powered Smart Detection】Take your security to the next level by recognizing humans, vehicles, and pets. It filters out false alerts from irrelevant motion and delivers real-time notifications for events that truly matter. Whether it’s a visitor, a car, or your pet, you stay clearly informed and in control. 【Red-&-Blue Deterrence with Siren】Deter threats before they happen with powerful red-and-blue warning lights and a built-in siren. When motion is detected, the system activates a striking visual alert and loud alarm to scare off intruders instantly. This proactive defense doesn’t just record crime—it helps prevent it, giving you added peace of mind around the clock. 【DIY Easy PoE Installation, Plug-&-Play】Elder makes security simple with true plug-and-play PoE. Just one Ethernet cable powers each camera while delivering video, audio, and a rock-solid connection—no hassle, no complexity. Whether you're a DIY beginner or a home security pro, setup is effortless and installation is clean. 【Dual-Light Color Night Vision & IR】Elder security cameras light up the night with advanced dual-light technology—combining powerful spotlights and infrared for unmatched clarity after dark. Customize your night vision with full-time spotlight, discreet IR, or smart motion-activated lighting. See every moment, even in complete darkness, with vivid detail and total control. 【Two-Way Talk】Listen and speak through the camera in real time—greet visitors, guide deliveries, or deter intruders instantly, all from the convenience of your smartphone. 【Local Storage All-Day 24/7 Recording】Enjoy nonstop protection with 24/7 local recording and H-265+ video compression—no cloud fees, no subscriptions. The system comes with a pre-installed security-grade hard drive and supports up to 10TB of expandable storage. Footage is automatically overwritten, so your system stays efficient while capturing every critical moment, day and night. 【IP67 Weatherproof Heavy-Duty】Engineered for any environment, these IP67-rated security cameras are built tough with a heavy-duty metal body and weather-sealed Ethernet connection for maximum durability. Whether installed indoors or outdoors, they stand strong against rain, snow, dust, heat, and wind—delivering reliable, all-season protection and peace of mind in any condition. 【NDAA Compliant】Built for secure and trusted use in sensitive environments, making it ideal for government, commercial, and professional security installations. 【Remote Access & Free Smart App】Stay connected anytime, anywhere with the free smart app. Instantly view live footage, receive real-time motion alerts, and replay recorded events—all from your smartphone, no matter where you are. Setup is quick and simple: just connect the NVR to the internet, install the app, and you’re ready to go. For local viewing, connect the NVR directly to a monitor via HDMI and keep eyes on what matters most—right at your fingertips. 【Works With or Without the Internet】The system runs seamlessly without internet access—perfect for locations without connectivity. Simply connect the NVR to a monitor via HDMI to view live feeds and playback recordings locally. Internet is only needed if you want to access your cameras remotely through the smart app, giving you full flexibility and control, with or without a network connection. 【No Monthly Fees】Protect your home with powerful, subscription-free security. Thanks to built-in local storage and free features, this system offers complete protection without hidden costs or monthly fees—just reliable, all-in-one surveillance you own outright. 【Designed in Canada & Top 20】Proudly designed in Canada, our security systems, cameras, NVRs, and DVRs combine innovation, durability, and trusted performance—built to safeguard what matters most.",https://www.bestbuy.ca/en-ca/product/elder-ai-4k-security-camera-system-8ch-nvr-4tb-poe-8-camera-outdoor-person-vehicle-detection-ndaa-red-blue-deterrence-spotlight-home-surveillance-8mp-wired-diy-rb-series/16342870
Blink Outdoor 4 Wire-Free 1080p Full HD IP Security Camera System with Sync Module Core - 3 Pack,,4.51,4,"Complete package and easy setup Comes with three Outdoor 4 cameras, one Sync Module Core, two AA Energizer lithium batteries, one mounting kit, one USB-C cable, and one power adapter Wire-free connection makes installation easy and keeps your space clutter-free Wi-Fi connectivity allows seamless access and control from anywhere using the Blink app Clear vision and smart alerts 1080p full HD resolution delivers clear, detailed video, so you never miss a moment Infrared night vision captures clear footage in the dark to keep your home protected 24/7 Enhanced motion detection sends quick alerts to your phone with dual-zone coverage for improved awareness Two-way talk with the Blink app lets you hear and speak to visitors right from your phone Person detection uses smart computer vision to alert you when a person is spotted, available with a Blink subscription plan (sold separately) Flexible storage and voice control Save and share clips with secure cloud storage included in the free 30-day trial Blink subscription plan (sold separately) Local backup with Sync Module XR and a microSD card (up to 256GB - each sold separately) lets you securely store footage without the cloud Works with Amazon Alexa, letting you control live view and system settings hands-free using voice commands Offers up to two years of power with the included AA Energizer lithium batteries and a Blink Sync Module Core",https://www.bestbuy.ca/en-ca/product/blink-outdoor-4-wire-free-1080p-full-hd-ip-security-camera-system-with-sync-module-core-3-pack/19333141
Hidensa Mini IP Camera WiFi Home Security Surveillance Nanny Camcorder with 2 Way Audio Motion Detection Night Vision -Black,,4.79,2,"Two Way Audio: Built in speaker and microphone in the camera, it is convenience for you to communicate with your family members and pets, you can also see them via video on your phone or other devices anytime and anywhere.Motion Detection & Night Vision: When detecting moving objects, our home security camera will automatically send an alarm notification to your phone, you don’t need to worry about missing any important things. The WiFi camera adopts advanced IR-CUT Filter technology, even in a low light condition, it also can offer a clear display.Remote View: Just download APP on your phone or other devices, connect to the mini camera, you can view a LIVE video remotely from anywhere, at anytime. One WiFi camera supports 5 people to watch live feed video online at the same time, so you can share it to your family members. It doesn't support 5G WIFI Network. Video Storage & Loop Recording: Support cloud services(Need to pay for subscription) and micro SD memory card up to 128G(Not included). When the card is full, it will automatically overwrite the old video files with new ones, no longer worry about the camera will stop recording when it is full.",https://www.bestbuy.ca/en-ca/product/hidensa-mini-ip-camera-wifi-home-security-surveillance-nanny-camcorder-with-2-way-audio-motion-detection-night-vision-black/15754678
Open Box - eufy eufyCam 2C Pro Wireless Security System with 3 2K Cameras and HomeBase 3 - White,,4.79,2,"Open Box - eufyCam 2C Pro+ 3-Camera with HomeBase 3 Wireless Home Security System 2K Resolution; Self-learning A.I.; 180-Day Battery Life; Expandable Storage; No Monthly Fee Know what’s happening at and around your home with the eufyCam 2C Pro+ system. 180-day battery life, up to 16TB expandable storage, and IP67 weatherproof rating deliver stellar whole-home protection. Three cameras produce crisp 2K resolution while new HomeBase 3 hub with BionicMind™ self-learning A.I. intelligently detects and alerts* only when a human approaches - improving recognition accuracy to 99.9%. Added convenience with local storage** and no monthly fees. *Push notifications with thumbnail previews require thumbnail preview images to be temporarily stored in the cloud. **If you choose to use cloud-based features such as cloud storage or push notifications with thumbnail previews, videos or thumbnail previews will be sent to the cloud as needed to provide your selected features. Note: HomeBase 3 can only be connected to the router by cable to ensure strong connection. HomeBase 3 cannot connect to your network via Wi-Fi. The Wi-Fi repeater function of Homebase 3 supports 2.4 GHz Wi-Fi only.""",https://www.bestbuy.ca/en-ca/product/open-box-eufy-eufycam-2c-pro-wireless-security-system-with-3-2k-cameras-and-homebase-3-white/18161738
"【2025 New】Elder 4K Security Camera System Spotlight, 4-Camera DVR Surveillance Kit Outdoor DIY Wired 1TB Audio Color Night Vision, Home Security Camera System",,4.79,4,"【4K Ultra HD - 8MP Resolution】 4K means there are over 8 million pixels which are more than 4X the number of pixels of Full HD 1080P. It results in vivid resolution, sharper video, and realistic color representation and makes the faces, license plates, details, and close-ups much clearly during the day and night time even when you digitally zoom into far away objects. With Elder 4K security camera system, you'll experience the difference that 4K resolution (3840 x 2160) makes when it runs to your surveillance system. 【Color Night Vision, Full-Color NV】 Elder security camera system color night vision spotlight allows you to get full-color images even in extremely low-light conditions with the state-of-the-art spotlight night vision technology. Full-Color Night Vision technology brings you a higher level of security and enhances image qualities in the nighttime. 【 DIY Easy Installation, Plug-&-Play】 Elder security camera system is a real plug-&-play DVR surveillance system! Only a cctv cable (included) is needed for the connection between the camera and the DVR for video, power, and audio. A plug-&-play connection makes it simple to set up and install your DVR security camera system, especially for beginners and fans of DIY (Do-It-Yourself) security systems. 【Intelligent Detection & Smart Playback】 Thanks to this innovative feature, you will get an immediate push notification to your smartphone via its smart app whenever a movement, a person, or a vehicle is detected on your home & property. So, you can act immediately to prevent unwanted activity. You also can customize the detection zone from your DVR to effectively reduce the number of unwanted false alarms. With smart area playback technology, you can select a specific area of the image to automatically search for movement within recordings. 【Built-in Mic & Listen-in Audio】 The Elder cameras come equipped with built-in microphones that allow for crystal-clear audio. It features Audio-over-Coax technology, which means the audio and video will be transmitted over a single coaxial cable. An audio recording would enhance the security coverage and add a significant new feature to your security system, as you will have recorded videos with clear audio and voice. 【H.265 / HEVC Video Compression】 This advanced encoding technology compresses video file sizes without sacrificing any quality which improves bandwidth efficiency, saves hard drive storage space and reduces storage costs. This new type of encoding can save up to 50% more space when compared to conventional H.264, so the hard drive could record for a much longer time with H.265 recording technology. 【HDD Storage All-Day 24/7 Recording】 With a pre-installed security-grade hard drive, users are provided continuous 24/7 local recording and all-around protection for home & business without any additional costs or subscription fees. Elder DVR has the possibility of increasing local storage space up to 8TB. You can also backup and transfer the desired playbacks from stored videos to a USB memory or external hard drive. Elder DVR automatically overwrites the oldest internally stored footage. 【Weatherproof Heavy-Duty Housing IP67】 This system’s cameras are suitable for anywhere, outdoor or indoor installation. The weatherproof rating and heavy-duty exterior add extra protection against vandalism and harsh weather, providing you truly year-round protection. Elder weatherproof cameras can withstand pretty much anything, such as snowfalls, rain, dust, heat, and wind, all year round. 【Remote Access & Free Smart App】Using this system’s free app, you can remotely view your security cameras, receive motion-activated push notifications, and check playbacks from your smartphone at all times, no matter where you are. You only need to connect the DVR to the internet via Ethernet cable, install the free app, and set it up. Stay connected to your home and business anytime and anywhere. To locally view, connect the DVR to your monitor through an HDMI or VGA cable. 【Genuine Chipsets and Sensors】 Elder security camera systems are made of hi-tech genuine chipsets and sensors. Elder security systems come with the latest new technologies and top up-to-date advanced features and trending smart solutions. 【With or Without the Internet】 Elder security camera system doesn't need the internet to operate except when you wish to use a smart device to access features such as notification or remote monitoring. Without existing internet, you can simply use local outputs to monitor, and local storage to check playbacks. 【No Monthly Fees】 Elder security camera system features a pre-installed local storage HDD and a free professional app for remote viewing, so it works entirely without any contracts and monthly fees. You don’t need to pay any subscription or monthly fees for cloud, video storage, and smartphone app, making it the top surveillance system for your home and business. 【New CCTV Security System】 This Elder security camera system is a verified new product. No refurbished, no open-box, and no used. 【Designed in Canada & Top 20】 Elder security systems, Elder security cameras, Elder NVRs, and Elder DVRs are proudly designed in Canada. Elder rates are among the top 20 surveillance brands worldwide.",https://www.bestbuy.ca/en-ca/product/2025-new-elder-4k-security-camera-system-spotlight-4-camera-dvr-surveillance-kit-outdoor-diy-wired-1tb-audio-color-night-vision-home-security-camera-system/15723632
Arlo Essential Wire-Free Indoor/Outdoor 2K Security Camera (2nd Generation) - White,,4.33,2,"Wire-free solution for detailed monitoring Security camera offers seamless installation with a direct Wi-Fi connection for a hassle-free, wire-free setup Crystal-clear 2K video lets you see fine details, so nothing goes unnoticed Powerful 12x zoom brings distant details closer to easily identify faces and license plates Colour night vision ensures clear visibility in low-light conditions, letting you monitor your home with confidence after dark Real-time alerts and two-way communication Arlo Secure app ensures easy remote monitoring by detecting motion and providing two-way audio Motion detection alerts you instantly to any movement, keeping you informed about activity around your home. It also lets you watch live videos Noise-cancelling two-way audio allows for clear communication with visitors, even in noisy environments Arlo Secure Plan for enhanced protection 30-day trial Arlo Secure Plan is included to offer access to stored cloud videos and audio recordings for 30 days, anytime, anywhere (requires an Arlo Secure paid subscription after the trial period, and some Arlo Secure services may be unavailable in certain regions. For current information on features that need a paid subscription, visit Arlo's website) Person and vehicle recognition helps you know exactly who has arrived at your home Receive alerts when a package or animal is detected Custom detection sends specific notifications for events or scenarios you create Smart activity zones notify you only of the events that matter most Intelligent home security Motion, sound, and light sensors work together to detect activity and keep you instantly informed of any unusual events Use the integrated spotlight or activate the integrated siren automatically or manually to scare off intruders and alert those nearby Pet mode helps reduce false alerts by recognizing and ignoring your pets' movements Robust design with smart home compatibility Designed to work flawlessly in any environment, whether indoors and outdoors All-weather protection ensures reliable performance in heat, cold, rain, or sun throughout every season Rechargeable battery and easy mounting make DIY installation quick and hassle-free Works with Amazon Alexa, Apple Home, SmartThings, IFTTT, and Google Home to enhance your smart home setup and control (Apple Home compatibility requires connection to a compatible Arlo SmartHub or Base Station.) Add more Arlo cameras both inside and outside, and easily connect them all for complete home coverage",https://www.bestbuy.ca/en-ca/product/arlo-essential-wire-free-indoor-outdoor-2k-security-camera-2nd-generation-white/17278926
Google Nest Cam Wire-Free Indoor/Outdoor Security Camera - White,,4.51,1080,"Nest Cam battery camera shows you what’s happening at home, and alerts you of important activity, no matter where you are See live video in 1080p HD, so you can check up on things whenever you want, from anywhere Up to 3 hours of free event video history lets you go back and see what happened in the Google Home app Nest Cam alerts you about important things so that you can decide to take action right from the Google Home app You can also talk and listen from anywhere through the camera’s built-in microphone and speaker HDR imaging and night vision mean you can enjoy bright and clear video day or night, even in challenging light conditions It's battery-powered and weather-resistant design with charging temperature range of 0°C to 40°C lets you install the camera yourself, outside or in the home. Available stand makes it easy to set up wherever you want (Stand and other accessories sold separately) Encrypted video, two-step verification and enhanced security through your Google Account help protect your privacy Green LED light lets you know when the camera is processing or streaming video Familiar face detection helps you teach your Nest camera how to tell the difference between the faces you know and don't know. Over time, it can start to recognise people you know and send you more helpful alerts (Requires Nest Aware subscription (sold separately)) Home and Away routines feature give you the option to automatically turn off the camera when you’re home, so no video is streamed or recorded until you leave Nest Cam requires a Wi-Fi network, a working broadband internet connection with at least 2 Mbps upload speed per camera for optimal performance (DSL may not qualify), a compatible mobile device, the free Home app, and a Google Account Add a Nest Aware subscription (sold separately) so you can get up to 60 hours of video history and alerts that matter",https://www.bestbuy.ca/en-ca/product/google-nest-cam-wire-free-indoor-outdoor-security-camera-white/15621548
Blink Outdoor 4 Wire-Free 1080p Full HD IP Security Camera System with Sync Module Core - 5 Pack,,4.51,4,"Total security made simple Comes with five Outdoor 4 cameras, one Sync Module Core, two AA Energizer lithium batteries, one mounting kit, one USB-C cable, and one power adapter Wire-free connection makes installation easy and keeps your space clutter-free Wi-Fi connectivity allows seamless access and control from anywhere using the Blink app Crisp view and smart alerts 1080p full HD resolution delivers clear, detailed video for sharp monitoring and easy identification Infrared night vision captures clear footage in the dark to keep your home protected 24/7 Enhanced motion detection sends quick alerts to your phone with dual-zone coverage for improved awareness Two-way audio with the Blink app lets you hear and speak to visitors right from your phone Person detection uses smart computer vision (CV) to alert you when a person is spotted, available with an optional Blink subscription plan (sold separately) Secure storage and voice control Save and share clips with secure cloud storage included in the free 30-day trial Blink subscription plan Local backup with Sync Module XR and a microSD card (up to 256GB - each sold separately) lets you securely store footage Works with Amazon Alexa, letting you control live view and system settings hands-free using voice commands Offers up to two years of power with the included AA Energizer lithium batteries and a Blink Sync Module Core",https://www.bestbuy.ca/en-ca/product/blink-outdoor-4-wire-free-1080p-full-hd-ip-security-camera-system-with-sync-module-core-5-pack/19333144
