Title,Price,Rating,Number of Reviews,Description,URL
"【2025 New】Elder 4K Security Camera System Spotlight, 8-Camera 8Ch DVR Surveillance Kit Outdoor DIY Wired 2TB Audio Color Night Vision, Home Security Camera System",,4.79,4,"【4K Ultra HD - 8MP Resolution】4K means there are over 8 million pixels which are more than 4X the number of pixels of Full HD 1080P. It results in vivid resolution, sharper video, and realistic color representation and makes the faces, license plates, details, and close-ups much clearly during the day and night time even when you digitally zoom into far away objects. With Elder 4K security camera system, you'll experience the difference that 4K resolution (3840 x 2160) makes when it runs to your surveillance system. 【Color Night Vision, Full-Color NV】Elder security camera system color night vision spotlight allows you to get full-color images even in extremely low-light conditions with the state-of-the-art spotlight night vision technology. Full-Color Night Vision technology brings you a higher level of security and enhances image qualities in the nighttime. 【 DIY Easy Installation, Plug-&-Play】Elder security camera system is a real plug-&-play DVR surveillance system! Only a cctv cable (included) is needed for the connection between the camera and the DVR for video, power, and audio. A plug-&-play connection makes it simple to set up and install your DVR security camera system, especially for beginners and fans of DIY (Do-It-Yourself) security systems. 【Intelligent Detection & Smart Playback】Thanks to this innovative feature, you will get an immediate push notification to your smartphone via its smart app whenever a movement, a person, or a vehicle is detected on your home & property. So, you can act immediately to prevent unwanted activity. You also can customize the detection zone from your DVR to effectively reduce the number of unwanted false alarms. With smart area playback technology, you can select a specific area of the image to automatically search for movement within recordings. 【Built-in Mic & Listen-in Audio】The Elder cameras come equipped with built-in microphones that allow for crystal-clear audio. It features Audio-over-Coax technology, which means the audio and video will be transmitted over a single coaxial cable. An audio recording would enhance the security coverage and add a significant new feature to your security system, as you will have recorded videos with clear audio and voice. 【H.265 / HEVC Video Compression】This advanced encoding technology compresses video file sizes without sacrificing any quality which improves bandwidth efficiency, saves hard drive storage space and reduces storage costs. This new type of encoding can save up to 50% more space when compared to conventional H.264, so the hard drive could record for a much longer time with H.265 recording technology. 【HDD Storage All-Day 24/7 Recording】With a pre-installed security-grade hard drive, users are provided continuous 24/7 local recording and all-around protection for home & business without any additional costs or subscription fees. Elder DVR has the possibility of increasing local storage space up to 8TB. You can also backup and transfer the desired playbacks from stored videos to a USB memory or external hard drive. Elder DVR automatically overwrites the oldest internally stored footage. 【Weatherproof Heavy-Duty Housing IP67】This system’s cameras are suitable for anywhere, outdoor or indoor installation. The weatherproof rating and heavy-duty exterior add extra protection against vandalism and harsh weather, providing you truly year-round protection. Elder weatherproof cameras can withstand pretty much anything, such as snowfalls, rain, dust, heat, and wind, all year round. 【Remote Access & Free Smart App】Using this system’s free app, you can remotely view your security cameras, receive motion-activated push notifications, and check playbacks from your smartphone at all times, no matter where you are. You only need to connect the DVR to the internet via Ethernet cable, install the free app, and set it up. Stay connected to your home and business anytime and anywhere. To locally view, connect the DVR to your monitor through an HDMI or VGA cable. 【Genuine Chipsets and Sensors】Elder security camera systems are made of hi-tech genuine chipsets and sensors. Elder security systems come with the latest new technologies and top up-to-date advanced features and trending smart solutions. 【With or Without the Internet】Elder security camera system doesn't need the internet to operate except when you wish to use a smart device to access features such as notification or remote monitoring. Without existing internet, you can simply use local outputs to monitor, and local storage to check playbacks. 【No Monthly Fees】Elder security camera system features a pre-installed local storage HDD and a free professional app for remote viewing, so it works entirely without any contracts and monthly fees. You don’t need to pay any subscription or monthly fees for cloud, video storage, and smartphone app, making it the top surveillance system for your home and business. 【New CCTV Security System】This Elder security camera system is a verified new product. No refurbished, no open-box, and no used. 【Designed in Canada & Top 20】Elder security systems, Elder security cameras, Elder NVRs, and Elder DVRs are proudly designed in Canada. Elder rates are among the top 20 surveillance brands worldwide.",https://www.bestbuy.ca/en-ca/product/2025-new-elder-4k-security-camera-system-spotlight-8-camera-8ch-dvr-surveillance-kit-outdoor-diy-wired-2tb-audio-color-night-vision-home-security-camera-system/16663677
Arlo Ultra 2 Spotlight Camera Security System Bundle w/ 3 Wire-Free Indoor/Outdoor 4K Cameras - White - Only at Best Buy,,4.79,2,"Exclusive Best Buy value bundle—a $1,500 value if purchased separately (Value if products purchased separately at the regular prices) Includes three Ultra 2 cameras, one base station, four rechargeable batteries, one dual battery charging station, three anti-theft mounts, and one security yard sign. Stable and superior performance Includes three IP security camera that let you to keep an eye on your home, properties, and more 12x zooming lets you to observe every tiny detail in amazing clarity Dual band Wi-Fi connectivity ensures enhanced range and stable performance with the help of hub Amazing picture quality 4K camera with 3840 x 2160 video resolution let you witness every visitor and objects clearly Ultra-wide angle lens with 180-degree diagonal field of view records large areas for your safety Auto image correction minimizes fish-eye effect to deliver crisp and clear recordings Colour night vision allows you to monitor your property even in low-light conditions Get real-time updates Motion detection recognize movement and alert you immediately with notifications Two-way audio with noise and echo cancellation technology let you talk and listen everything in crisp clarity Supports microSD card storage (not included) to save your recordings for easy monitoring through the Arlo SmartHub app Built-in siren and integrated spotlight scare away unwanted visitors for your safety Hassle-free usage Wire-free indoor and outdoor camera can easily withstand elements for hassle-free usage Swappable rechargeable batteries are extremely convenient to use Amazon Alexa, Google Assistant, and Apple HomeKit compatibility let you to control the camera using simple voice commands",https://www.bestbuy.ca/en-ca/product/arlo-ultra-2-spotlight-camera-security-system-bundle-w-3-wire-free-indoor-outdoor-4k-cameras-white-only-at-best-buy/15521257
1080P HD IP Camera Smart WiFi Home Security Camera Surveilance Camera with PIR Motion Detection Home Security,,4.06,1080,"Home Security Camera can achieve realtime twoway voice intercom. The camera has a builtin speaker and microphone, noise reduction and fidelity to keep the sound clear when receiving, so that the elderly and children in your family can give you immersive sound and visual enjoy.The IP camera has the function of smart PIR and motion detection. Suspicious mobile intruders in the lens scan the face, trigger the monitoring to automatically save the video, the builtin abnormal alarm push function instantaneously send and receive mobile phone Information.The camera supports multiplatform device interconnection, applicable to corresponding APPs for IOS/Android, and computers. Support multiple users with one device, or multiple devices with one user, support mobile and tablet sharing and watching, and suport for tuya APP and wifi connection.The wideangle PTZ supports vertical 80° adjustment and horizontal 355° rotation for various scene. The appropriate angle can be adjusted according to installation needs and methods. Also support for Amazon Alexa and for Google Home intelligent voice control, remote wakeup, remote monitoring, remote control of the camera rotation angle, eliminating the trouble of disassembly and assembly, can be wallmounted, hoisted, and flatmounted.",https://www.bestbuy.ca/en-ca/product/1080p-hd-ip-camera-smart-wifi-home-security-camera-surveilance-camera-with-pir-motion-detection-home-security/15748186
Alarm.com 1080P HD Indoor/Outdoor Dome Security Camera ADC-VC826,,4.06,1080,"The ADC-VC826 from Alarm.com is a high-performance fixed dome camera optimized for indoor and outdoor video monitoring. Its discreet, compact design and outstanding HD quality video make the camera ideal for both commercial and residential video installations. The camera features a vandal-resistant exterior casing with an IP67 rating and Power over Ethernet (PoE) capabilities. Features Power over Ethernet IR night vision Vandal resistant 1080p HD video IP-67 rated waterproof & dust-tight This allows the camera to be mounted outdoors IP-67 also protects against the effects of immersion in water to depth between 15 cm and 1 meter when immersed for 30 minutes Video Analytics, Video Motion Detection, and sensor-triggered clips saved to the cloud",https://www.bestbuy.ca/en-ca/product/alarm-com-1080p-hd-indoor-outdoor-dome-security-camera-adc-vc826/17716856
Open Box - eufy SoloCam S340 Solar Security Camera Bundle,,4.79,340,"Open Box - Enhanced Dual-Camera Clarity at 50 Feet: Capture every event that occurs around your home in ultra-clear 3K resolution. See exactly who is approaching your home with 8× zoom - Solar-Powered, Install Once and it Runs Forever*: Experience constant peace of mind with this solar-powered security camera that's easy to set up and always on, thanks to its removable solar panel - 360° Guardian, No Blind Spots: Say goodbye to blind spots with full home coverage. Enjoy 360° surveillance, check your front porch, monitor your backyard, and keep an eye on the driveway with ease - Experience Dual Views for Ultimate Surveillance: See the big picture while zooming in on crucial details, all in one frame - Local Storage, No Monthly Fee: One-time purchase. No monthly fee or hidden costs - Versatile Installation, Effortless Setup: Experience the convenience of a 5-minute installation with its compact size and wire-free design - Compatible with HomeBase S380 with firmware version V3.3.2.6 and above Includes: eufy SoloCam S340 Bundle Specifications: Dimensions (L × W × H/D): 8.69 cm × 8.69 cm × 11.99 cm (3.42 in. × 3.42 in. × 4.72 in.) Weight: 1.15 kg (2.53 lb.)",https://www.bestbuy.ca/en-ca/product/open-box-eufy-solocam-s340-solar-security-camera-bundle/19350806
Light Bulb Camera WiFi Night Vision Security Point Surveillance Camera HD Camera (without memory card),,5.0,360,"Built-in hotspot, remote viewing at any time. Built-in microphone, two-way voice intercom. Intelligent dual-light full-color night vision camera. 360-degree panoramic view, every corner is clearly visible. Remote HD playback on mobile phone, loop recording, automatic overwriting when full. HD pixels (1920*1080P), motion detection, two-way intercom, remote viewing, long-term battery life, memory expansion, cloud storage. Package contents: host/instructions/accessories Note! This product does not come with a memory card, you need to bring your own 8G-128G memory card for use.",https://www.bestbuy.ca/en-ca/product/light-bulb-camera-wifi-night-vision-security-point-surveillance-camera-hd-camera-without-memory-card/19292244
