Title,Price,Rating,Number of Reviews,Description,URL
Blink Outdoor 4 Wire-Free 1080p Full HD Add-On IP Security Camera - Black,,4.61,4,"24/7 wire-free security IP security camera lets you see what is going on in and around your home 2.4GHz 802.11b/g/n wireless system is easy to install without the need for complex wiring and allows flexible placement all over your space See, hear, and speak with crystal clarity 1080p Full HD camera captures everything that is going on with detailed video quality 143-degree viewing angle gives you an expansive field of view that covers plenty of area in 1 frame Infrared night vision technology makes this security system quite effective in dark or low light conditions Two-way audio communication lets you scare away potential trespassers or talk with visitors or delivery personnel over the Blink app You can remotely monitor your space thanks to the live HD feed on the Blink app Heightened vigilance and secure storage You can choose to store the recording locally with the Sync Module 2 and a USB drive (each sold separately) or save the data in the cloud with a 30-day trial of the Blink Subscription Plan Motion detection sensor alerts you instantly on your smartphone when triggered Person detection technology uses embedded computer vision to alert you when a human body is detected (Part of an optional Blink Subscription Plan that is sold separately) Durable battery and easy voice control Included AA lithium batteries hold enough charge to power the camera for up to 2 years Compatible with Amazon Alexa, you can activate live view, arm/disarm the system, and do more with nothing but your voice",https://www.bestbuy.ca/en-ca/product/blink-outdoor-4-wire-free-1080p-full-hd-add-on-ip-security-camera-black/17194843
Arlo Pro 5S Wire-Free Indoor/Outdoor 2K Security Camera - 3 Pack - White - Only at Best Buy,,4.14,5,"Effortless setup and seamless integration Package includes three cameras, and you can easily expand by adding more Arlo cameras Wireless setup lets you install and adjust the camera quickly Works seamlessly with Amazon Alexa, Apple Home1, Google Home, SmartThings, and IFTTT Dual-band Wi-Fi automatically connects to the strongest network, ensuring stable performance Thorough monitoring solution 2K HDR video delivers sharp, detailed images for a clear view 160-degree wide viewing angle captures more of your surroundings Colour night vision helps you identify critical detail even in dark conditions Integrated spotlight lights up your yard and deters intruders Clear two-way audio lets you communicate easily with visitors Personalized security Camera sends instant motion alerts to your phone through the Arlo Secure App Custom detection zones let you receive notifications for specific events Cloud storage and smart alerts Camera stores video and audio recordings in the cloud for 30 days, accessible anytime A 30-day Arlo Secure Plan2 trial gives you full access to features Person and vehicle recognition ensures accurate alerts Smart activity zones help you focus on the most important events All-weather protection and effortless setup Use the camera indoors or outdoors with all-weather protection It withstands heat, cold, rain, and sun for year-round reliability The magnetic charging cable makes recharging quick and easy Wireless setup and adjustable mount make installation a breeze 1Apple Home compatibility requires connection to a compatible Arlo SmartHub or Base Station.2Requires an Arlo Secure paid subscription after the trial period, and some Arlo Secure services may be unavailable in certain regions. For current information on features that need a paid subscription, visit Arlo website",https://www.bestbuy.ca/en-ca/product/arlo-pro-5s-wire-free-indoor-outdoor-2k-security-camera-3-pack-white-only-at-best-buy/17291371
eufy eufyCam S3 Pro Wire-Free 4K Ultra HD Outdoor Security Camera with Solar Panel - 2 Pack,,4.36,3,"Pack of two wire-free trail cameras for comprehensive outdoor monitoring Wi-Fi 802.11b/g/n connectivity enables seamless monitoring and a hub is required for optimal performance and control 4K Ultra HD resolution with MaxColor Vision technology delivers crystal-clear, detailed footage, providing day-like image clarity even in complete darkness without a spotlight 112-degree horizontal and 61-degree vertical viewing angles give a wide field of vision for comprehensive coverage of your surroundings Dual motion detection system with radar and passive infrared (PIR) alerts you only to significant human movement and reduces false alarms by 99% Supports two-way communication, allowing you to listen and speak through the device for interactive conversations Omni-directional microphone captures clear sound from all directions, ensuring you don't miss any audio App-enabled for remote monitoring, giving you control and access to your security system from anywhere 16GB of on-device storage and up to 16TB expandable capacity provide ample space for all your recordings without any monthly fee Built-in siren provides an added layer of security by alerting you and deterring intruders with a loud sound HomeBase S380 features self-learning AI for smart device management, effortless group control, and enhanced privacy protection Compatible with Apple Home, Alexa, and Google Assistant for seamless integration and voice control Ensures year-round peace of mind with continuous security powered by SolarPlus 2.0 technology Large solar panel requires just one hour of direct sunlight daily to stay fully charged Compatible with an external solar panel for flexible mounting (includes backup solar panel)",https://www.bestbuy.ca/en-ca/product/eufy-eufycam-s3-pro-wire-free-4k-ultra-hd-outdoor-security-camera-with-solar-panel-2-pack/18248963
Eufy SoloCam S340 Wire-Free Outdoor IP Camera - Black/White,,4.62,340,"Wireless camera provides flexible placement options and allows monitoring your outdoor spaces without the constraints of wires or cables Standalone camera designed to provide convenient and straightforward monitoring solutions without the need for additional hubs, bridges, or companion devices Enhanced dual-camera clarity at 50ft. makes sure that you can capture every event around your home in stellar 3K resolution 8x zooming capability lets you zoom in to capture even the smallest detail with pristine clarity 360-degree pan and 70-degree tilt coverage eliminates blind spots and makes sure that you can effortlessly monitor your front porch, yards, and driveway Wi-Fi 802.11b/g/n assures fast and stable wireless connections for uninterrupted surveillance and peace of mind 360-degree horizontal view angle and 140-degree vertical view angle provide comprehensive coverage, ensuring no area is left unseen Advanced night vision and motion detection capabilities ensure round-the-clock security for your home or property Two-way audio functionality allows you to hear and speak in real-time for enhanced security and convenient interaction with visitors Remotely monitor your property from anywhere, anytime, through the Eufy Security App Local recording capability allows you to store video recordings directly on your device or a local storage solution 8GB of storage offers sufficient space to store important video footage locally for easy access Built-in siren provides audible alerts to scare off intruders and notify you of potential dangers Advanced Human Detection AI ensures that you'll only receive relevant app notifications as it detects and tracks humans, pets, and vehicles Camera stays powered by a removable solar panel to ensure uninterrupted home surveillance Two hours of direct sunlight daily keeps the camera continuously powered even on overcast days Removable solar panel collects and stores 800mAh to 1,200mAh per day with optimal sunlight and the SoloCam S340 utilizes only 100mAh to 200mAh over a day and night of average use Built-in battery ensures up to three months of reserve power, guaranteeing that you're always covered, no matter the weather Compact size and wire-free design allows for hassle-free setup in just five minutes",https://www.bestbuy.ca/en-ca/product/eufy-solocam-s340-wire-free-outdoor-ip-camera-black-white/17725403
Blink Outdoor 4 Wire-Free 1080p Full HD IP Security Camera System with Sync Module Core - 1 Pack,,4.62,4,"Complete package and easy setup Comes with an Outdoor 4 camera, one Sync Module Core, two AA Energizer lithium batteries, one mounting kit, one USB-C cable, and one power adapter Wire-free connection makes installation easy and keeps your space clutter-free Wi-Fi connectivity allows seamless access and control from anywhere using the Blink app Clear vision and smart alerts 1080p full HD resolution delivers clear, detailed video, so you never miss a moment Infrared night vision captures clear footage in the dark to keep your home protected 24/7 Enhanced motion detection sends quick alerts to your phone with dual-zone coverage for improved awareness Two-way talk with the Blink app lets you hear and speak to visitors right from your phone Person detection uses smart computer vision to alert you when a person is spotted, available with a Blink subscription plan (sold separately) Flexible storage and voice control Save and share clips with secure cloud storage included in the free 30-day trial Blink subscription plan (sold separately) Local backup with Sync Module XR and a microSD card (up to 256GB - each sold separately) lets you securely store footage without the cloud Works with Amazon Alexa, letting you control live view and system settings hands-free using voice commands Offers up to two years of power with the included AA Energizer lithium batteries and a Blink Sync Module Core",https://www.bestbuy.ca/en-ca/product/blink-outdoor-4-wire-free-1080p-full-hd-ip-security-camera-system-with-sync-module-core-1-pack/19333142
TP-Link Tapo C510W Pan/Tilt Semi-Wireless Outdoor 2K IP Camera,,4.62,2,"Semi-wireless standalone camera does not require a hub ensuring seamless installation and flexible placement for optimal coverage Pan/tilt functionality allows easy adjustment of IP camera for comprehensive monitoring in a variety of settings Wi-Fi capability allows you to monitor your surroundings easily and stay connected to your surveillance system from anywhere with ease 2K resolution of 2304 x 1296 pixels offers unparalleled level of detail that surpasses traditional 1080p (1920 x 1080) cameras 360-degree horizontal and 130-degree vertical view range captures every angle and detail to keep you informed about everything happening around your property Three Night Vision modes including full-colour mode, infrared mode, and smart mode makes you feel secure around the clock In full-colour mode, two built-in spotlights illuminate scenes to capture detailed full-colour images for heightened security Infrared mode provides a visual distance of up to 98ft. at night while conserving energy by operating with spotlights off Smart mode lights up the environment and automatically switches to full-colour mode upon detecting a person or movement Smart Motion Tracking feature allows the camera to follow movement through high-speed rotation to keep a vigilant eye on more vital areas Multiple Detection options from Person Detection to Motion Detection and Activity Zones allow you to focus on what matters most Two-way communication lets you listen and speak through the camera in real time Remote monitoring enables you to monitor your property from anywhere Save your recorded videos to a microSD card, supporting up to 512GB for ample space to store detailed 2K footage Opt for Tapo Care cloud services for rich notifications with snapshots, encrypted protection, data backups, and a 30-day video clip history Allows recording your own audio as an alarm to enhance your security setup Ultra-bright and adjustable light in addition to the built-in siren helps to deter unwanted visitors from your property Outdoor camera with IP65 water and dust resistant design ensures reliable operation even in challenging weather conditions Works with Amazon Alexa and Google Assistant to add a new dimension of convenience to your home security setup",https://www.bestbuy.ca/en-ca/product/tp-link-tapo-c510w-pan-tilt-semi-wireless-outdoor-2k-ip-camera/17633947
"Defender AI POWERED Sentinel 4K Ultra HD Wired 8 Channel PoE NVR Security System, 6 Metal Cameras with 1TB HDD, Includes 2 Year Warranty and Extra 60 ft. Cable",,4.79,4,"AI-POWERED SMART HUMAN DETECTION Sentinel can detect human movement and alert you immediately, protecting your home or business while minimizing false alarms. FLASHING BLUE-RED LIGHT DETERRENCE Criminal deterrence is activated immediately with high-intensity blue-red flashing lights, a powerful LED spotlight. 4K CLEARVU™ WITH AI SMART ENCODING Breathtaking 4K Ultra HD captures even the finest details like faces or license plates with life-like clarity. AI SMART encoding optimizes footage to maximize storage. VIBRANT COLOR NIGHT VISION Turn pitch darkness into vibrant color with laser sharp image enhancement and spotlight illumination from up to 100ft. away PREMIUM QUALITY, DIY SETUP Professional grade metal-encased NVR with IP66 rated cameras that are designed to withstand extreme weather-conditions. NO MONTHLY FEES & LIMITLESS RECORDING Your security cockpit with mobile & web-based viewing/controls. Expandable local storage utilizes SecureGuard™ technology & bank-level encryption to protect your footage.",https://www.bestbuy.ca/en-ca/product/defender-ai-powered-sentinel-4k-ultra-hd-wired-8-channel-poe-nvr-security-system-6-metal-cameras-with-1tb-hdd-includes-2-year-warranty-and-extra-60-ft-cable/18933469
Night Owl Wired 2-Way Audio DVR Security System with 8 Bullet Indoor/Outdoor 2K Cameras - White,,4.79,2,"Comprehensive and reliable security DVR security system with four included cameras, and can be expanded with up to eight compatible Night Owl cameras Wired camera connection with BNC cable ensures highly reliable and lossless signal transmission More details in superior quality 2K resolution delivers crisp and clear video quality 80-degree horizontal view angle lets you see more details in every frame Night vision allows you to see what's happening in the night or dark Highly practical Cameras detect humans and vehicles and sends alerts to your mobile device, so you can respond quickly Two-way audio allows you to listen and communicate with someone on your property Send preset voice alerts and activate siren from the app to the camera to deter intruders Free mobile app lets you control the camera from anywhere All data and recordings are stored only on your recorder's hard drive through a secured wired connection (CCTV) without requiring internet connection, offering utmost protection and privacy Designed for reliable indoor and outdoor use — can withstand severe heat, cold, or rain",https://www.bestbuy.ca/en-ca/product/night-owl-wired-2-way-audio-dvr-security-system-with-8-bullet-indoor-outdoor-2k-cameras-white/18218221
TP-Link Tapo C200 Wireless Indoor 1080p Full HD Home Security Camera - White,,4.62,1080,"Wireless camera can be installed anywhere inside your home as there is no need for networking cable for installation Dome shape makes it perfect to fix the camera in places like front doors, or areas where onlookers may not expect a surveillance camera to be placed Pan and tilt movement with a range of 360-degree horizontal and 114-degree vertical range lets you cover the whole room for effective monitoring Compatible with 802.11 b/g/n networks that allow for easy integration into your existing home Wi-Fi network Full HD camera captures and records video in 1080p resolution and audio which means you can see and hear everything clearly Advanced Night Vision allows you to easily see what is going on even when the lights are dim Motion sensors monitor movement and send notifications without delay when movements are detected Two-way audio system with omnidirectional microphone paves way for effective communication between you and whoever is in the room Remote monitoring via App allows for controlling the camera and watching the footage in real time Supports SD cards (not included) up to 128GB for onboard data storage Built-in sound and light alarm immediately alert you of intruders Works well with Amazon Alexa and Google Voice Assistant for hands-free convenience LED indicator informs you that the camera is working and recording",https://www.bestbuy.ca/en-ca/product/tp-link-tapo-c200-wireless-indoor-1080p-full-hd-home-security-camera-white/15985005
TP-Link Tapo C100 Wi-Fi Indoor 1080p Full HD Security Camera - White,,4.62,1080,"Indoor camera can be installed anywhere in your home as there is no requirement for wires Compatible with 802.11 b/g/n network to offer integration into your home Wi-Fi network Full HD camera captures crystal clear 1080p resolution video and audio to let you see and watch faces and objects clearly Advanced Night Vision allows you to continue monitoring even in low-light conditions, providing a visual distance of up to 30 ft. Motion sensors effectively recognize movement and immediately alert you with precise notifications Two-way communication system meant for people on both sides to hear and speak with each other for effective communication Remote monitoring facility for watching everything the camera captures in real time Supports SD card storage (not included) up to 128GB for local storage of the recorded footage Built-in siren and light alarms scare away intruders and alert you when movement is detected LED indicator informs you that the camera is working and recording Easy to setup and maintain",https://www.bestbuy.ca/en-ca/product/tp-link-tapo-c100-wi-fi-indoor-1080p-full-hd-security-camera-white/15985006
"Defender AI POWERED Sentinel 4K Ultra HD Wired 8 Channel PoE NVR Security System, 4 Metal Cameras with 1TB HDD, Includes 2 Year Warranty and Extra 60 ft. Cable",,4.79,4,"AI-POWERED SMART HUMAN DETECTION Sentinel can detect human movement and alert you immediately, protecting your home or business while minimizing false alarms. FLASHING BLUE-RED LIGHT DETERRENCE Criminal deterrence is activated immediately with high-intensity blue-red flashing lights, a powerful LED spotlight. 4K CLEARVU™ WITH AI SMART ENCODING Breathtaking 4K Ultra HD captures even the finest details like faces or license plates with life-like clarity. AI SMART encoding optimizes footage to maximize storage. VIBRANT COLOR NIGHT VISION Turn pitch darkness into vibrant color with laser sharp image enhancement and spotlight illumination from up to 100ft. away PREMIUM QUALITY, DIY SETUP Professional grade metal-encased NVR with IP66 rated cameras that are designed to withstand extreme weather-conditions. NO MONTHLY FEES & LIMITLESS RECORDING Your security cockpit with mobile & web-based viewing/controls. Expandable local storage utilizes SecureGuard™ technology & bank-level encryption to protect your footage.",https://www.bestbuy.ca/en-ca/product/defender-ai-powered-sentinel-4k-ultra-hd-wired-8-channel-poe-nvr-security-system-4-metal-cameras-with-1tb-hdd-includes-2-year-warranty-and-extra-60-ft-cable/18933479
Arlo Essential Wire-Free Indoor/Outdoor 2K Security Camera (2nd Generation) - 2 Pack - White,,4.16,2,"Wire-free solution for detailed, multi-camera monitoring Pack of two indoor and outdoor security cameras Security camera offers seamless installation with a direct Wi-Fi connection for a hassle-free, wire-free setup Crystal-clear 2K video lets you see fine details, so nothing goes unnoticed Powerful 12x zoom brings distant details closer to easily identify faces and license plates Colour night vision ensures clear visibility in low-light conditions, letting you monitor your home with confidence after dark Real-time alerts and two-way communication Arlo Secure app ensures easy remote monitoring by detecting motion and providing two-way audio Motion detection alerts you instantly to any movement, keeping you informed about activity around your home. It also lets you watch live videos Noise-cancelling two-way audio allows for clear communication with visitors, even in noisy environments Arlo Secure Plan for enhanced protection 30-day trial Arlo Secure Plan is included to offer access to stored cloud videos and audio recordings for 30 days, anytime, anywhere (requires an Arlo Secure paid subscription after the trial period, and some Arlo Secure services may be unavailable in certain regions. For current information on features that need a paid subscription, visit Arlo's website) Person and vehicle recognition helps you know exactly who has arrived at your home Receive alerts when a package or animal is detected Custom detection sends specific notifications for events or scenarios you create Smart activity zones notify you only of the events that matter most Intelligent home security Motion, sound, and light sensors work together to detect activity and keep you instantly informed of any unusual events Use the integrated spotlight or activate the integrated siren automatically or manually to scare off intruders and alert those nearby Pet mode helps reduce false alerts by recognizing and ignoring your pets' movements Robust design with smart home compatibility Designed to work flawlessly in any environment, whether indoors and outdoors All-weather protection ensures reliable performance in heat, cold, rain, or sun throughout every season Rechargeable battery and easy mounting make DIY installation quick and hassle-free Works with Amazon Alexa, Apple Home, SmartThings, IFTTT, and Google Home to enhance your smart home setup and control (Apple Home compatibility requires connection to a compatible Arlo SmartHub or Base Station.) Add more Arlo cameras both inside and outside, and easily connect them all for complete home coverage",https://www.bestbuy.ca/en-ca/product/arlo-essential-wire-free-indoor-outdoor-2k-security-camera-2nd-generation-2-pack-white/17278925
Arlo Essential Wireless Indoor/Outdoor HD Security Camera (2nd Generation) - White - Only at Best Buy,,4.16,1080,"Wireless camera for crystal-clear monitoring Wire-free security camera offers seamless installation with a direct Wi-Fi connection for a hassle-free setup 1080p high definition video captures clear, detailed footage so you can see exactly what's happening Colour night vision ensures clear visibility in low-light conditions, so you can monitor your home with confidence, even in the dark Instant alerts and clear communication Arlo Secure app ensures easy remote monitoring by detecting motion and providing two-way audio Motion detection alerts you instantly to any movement, keeping you informed about activity around your home. It also lets you watch live videos Noise-cancelling two-way audio allows for clear communication with visitors, even in noisy environments Comprehensive security with Arlo Secure Plan 30-day trial Arlo Secure Plan is included to offer access to stored cloud videos and audio recordings for 30 days, anytime, anywhere (requires an Arlo Secure paid subscription after the trial period, and some Arlo Secure services may be unavailable in certain regions. For current information on features that need a paid subscription, visit Arlo's website) Person and vehicle recognition helps you know exactly who has arrived at your home Receive alerts when a package or animal is detected Custom detection sends specific notifications for events or scenarios you create Smart activity zones notify you only of the events that matter most Smart surveillance Motion, sound, and light sensors work together to detect activity and keep you instantly informed of any unusual events Use the integrated spotlight or activate the integrated siren automatically or manually to scare off intruders and alert those nearby Pet mode helps reduce false alerts by recognizing and ignoring your pets' movements Robust design and seamless smart home integration Designed to work flawlessly in any environment, whether indoors and outdoors All-weather protection ensures reliable performance in heat, cold, rain, or sun throughout every season Rechargeable battery and easy mounting make DIY installation quick and hassle-free Works with Amazon Alexa, Apple Home, SmartThings, IFTTT, and Google Home to enhance your smart home setup and control (Apple Home compatibility requires connection to a compatible Arlo SmartHub or Base Station.) Add more Arlo cameras both inside and outside, and easily connect them all for complete home coverage",https://www.bestbuy.ca/en-ca/product/arlo-essential-wireless-indoor-outdoor-hd-security-camera-2nd-generation-white-only-at-best-buy/17278919
